{
  "lines": [
    {
      "invoice": "ALPINE-0726",
      "consignment_ref": "AE-3001",
      "shipment_id": "SH-4107",
      "billed_amount": 304.0,
      "expected_amount": 304.0,
      "delta": 0.0,
      "disposition": "accept",
      "justification": "Billed amount matches the amount determined by the governing rate card; no discrepancy found.",
      "contract_clause": "alpine-express.md \u00a72"
    },
    {
      "invoice": "ALPINE-0726",
      "consignment_ref": "AE-3002",
      "shipment_id": "SH-4108",
      "billed_amount": 561.0,
      "expected_amount": 561.0,
      "delta": 0.0,
      "disposition": "accept",
      "justification": "Billed amount matches the amount determined by the governing rate card; no discrepancy found.",
      "contract_clause": "alpine-express.md \u00a72"
    },
    {
      "invoice": "ALPINE-0726",
      "consignment_ref": "AE-3003",
      "shipment_id": "SH-4109",
      "billed_amount": 237.5,
      "expected_amount": 237.5,
      "delta": 0.0,
      "disposition": "accept",
      "justification": "Billed amount matches the amount determined by the governing rate card; no discrepancy found.",
      "contract_clause": "alpine-express.md \u00a72"
    },
    {
      "invoice": "ALPINE-0726",
      "consignment_ref": "AE-3004",
      "shipment_id": "SH-4110",
      "billed_amount": 990.0,
      "expected_amount": 990.0,
      "delta": 0.0,
      "disposition": "accept",
      "justification": "Billed amount matches the amount determined by the governing rate card; no discrepancy found.",
      "contract_clause": "alpine-express.md \u00a72"
    },
    {
      "invoice": "ALPINE-0726",
      "consignment_ref": "AE-3005",
      "shipment_id": "SH-4111",
      "billed_amount": 475.0,
      "expected_amount": null,
      "delta": null,
      "disposition": "escalate",
      "justification": "The shipment record confirms billed_weight_kg is exactly 50.0, and the chargeable weight floor (\u00a71, 25kg minimum) does not change this since actual weight already exceeds the floor. Under \u00a72, the rate bands are stated as strictly \"under 50 kg\" (\u20b99.50/kg) and \"over 50 kg\" (\u20b98.25/kg), with no rate stated for exactly 50 kg. This is a genuine textual gap between adjacent bands, not a computable pricing scenario: reading \"under 50 kg\" to include 50 kg, or reading \"over 50 kg\" to include 50 kg, are both plausible but contradictory interpretations, and the contract gives no tiebreaker. The rate card's own ambiguities list independently confirms this exact gap at \u00a72. Per policy, a genuine rate-band gap that the deterministic pricing engine could not resolve must default to escalate rather than have either party (or me) pick a band that isn't actually written in the contract.",
      "contract_clause": "alpine-express.md \u00a71, alpine-express.md \u00a72"
    },
    {
      "invoice": "ALPINE-0726",
      "consignment_ref": "AE-3006",
      "shipment_id": "SH-4112",
      "billed_amount": 392.25,
      "expected_amount": 392.25,
      "delta": 0.0,
      "disposition": "accept",
      "justification": "Billed amount matches the amount determined by the governing rate card; no discrepancy found.",
      "contract_clause": "alpine-express.md \u00a72, alpine-express.md \u00a74"
    },
    {
      "invoice": "ALPINE-0726",
      "consignment_ref": "AE-3007",
      "shipment_id": "SH-4113",
      "billed_amount": 660.0,
      "expected_amount": 660.0,
      "delta": 0.0,
      "disposition": "accept",
      "justification": "Billed amount matches the amount determined by the governing rate card; no discrepancy found.",
      "contract_clause": "alpine-express.md \u00a72"
    },
    {
      "invoice": "ALPINE-0726",
      "consignment_ref": "AE-3008",
      "shipment_id": "SH-4114",
      "billed_amount": 453.75,
      "expected_amount": 453.75,
      "delta": 0.0,
      "disposition": "accept",
      "justification": "Billed amount matches the amount determined by the governing rate card; no discrepancy found.",
      "contract_clause": "alpine-express.md \u00a72"
    },
    {
      "invoice": "ALPINE-0726",
      "consignment_ref": "AE-3009",
      "shipment_id": "SH-4115",
      "billed_amount": 380.0,
      "expected_amount": 380.0,
      "delta": 0.0,
      "disposition": "accept",
      "justification": "Billed amount matches the amount determined by the governing rate card; no discrepancy found.",
      "contract_clause": "alpine-express.md \u00a72"
    },
    {
      "invoice": "ALPINE-0726",
      "consignment_ref": "AE-3010",
      "shipment_id": "SH-4116",
      "billed_amount": 783.75,
      "expected_amount": 783.75,
      "delta": 0.0,
      "disposition": "accept",
      "justification": "Billed amount matches the amount determined by the governing rate card; no discrepancy found.",
      "contract_clause": "alpine-express.md \u00a72"
    },
    {
      "invoice": "ALPINE-0726",
      "consignment_ref": "AE-3011",
      "shipment_id": "SH-4117",
      "billed_amount": 285.0,
      "expected_amount": 285.0,
      "delta": 0.0,
      "disposition": "accept",
      "justification": "Billed amount matches the amount determined by the governing rate card; no discrepancy found.",
      "contract_clause": "alpine-express.md \u00a72"
    },
    {
      "invoice": "ALPINE-0726",
      "consignment_ref": "AE-3012",
      "shipment_id": "SH-4118",
      "billed_amount": 645.0,
      "expected_amount": 645.0,
      "delta": 0.0,
      "disposition": "accept",
      "justification": "Billed amount matches the amount determined by the governing rate card; no discrepancy found.",
      "contract_clause": "alpine-express.md \u00a72, alpine-express.md \u00a74"
    },
    {
      "invoice": "ALPINE-0726",
      "consignment_ref": "AE-3013",
      "shipment_id": "SH-4119",
      "billed_amount": 237.5,
      "expected_amount": 237.5,
      "delta": 0.0,
      "disposition": "accept",
      "justification": "Billed amount matches the amount determined by the governing rate card; no discrepancy found.",
      "contract_clause": "alpine-express.md \u00a72"
    },
    {
      "invoice": "ALPINE-0726",
      "consignment_ref": "AE-3014",
      "shipment_id": "SH-4120",
      "billed_amount": 589.88,
      "expected_amount": 589.88,
      "delta": 0.0,
      "disposition": "accept",
      "justification": "Billed amount matches the amount determined by the governing rate card; no discrepancy found.",
      "contract_clause": "alpine-express.md \u00a72"
    },
    {
      "invoice": "ALPINE-0726",
      "consignment_ref": "AE-3015",
      "shipment_id": "SH-4121",
      "billed_amount": 342.0,
      "expected_amount": 342.0,
      "delta": 0.0,
      "disposition": "accept",
      "justification": "Billed amount matches the amount determined by the governing rate card; no discrepancy found.",
      "contract_clause": "alpine-express.md \u00a72"
    },
    {
      "invoice": "ALPINE-0726",
      "consignment_ref": "AE-3016",
      "shipment_id": "SH-4122",
      "billed_amount": 726.0,
      "expected_amount": 726.0,
      "delta": 0.0,
      "disposition": "accept",
      "justification": "Billed amount matches the amount determined by the governing rate card; no discrepancy found.",
      "contract_clause": "alpine-express.md \u00a72"
    },
    {
      "invoice": "ALPINE-0726",
      "consignment_ref": "AE-3017",
      "shipment_id": "SH-4123",
      "billed_amount": 446.5,
      "expected_amount": 446.5,
      "delta": 0.0,
      "disposition": "accept",
      "justification": "Billed amount matches the amount determined by the governing rate card; no discrepancy found.",
      "contract_clause": "alpine-express.md \u00a72"
    },
    {
      "invoice": "ALPINE-0726",
      "consignment_ref": "AE-3018",
      "shipment_id": "SH-4124",
      "billed_amount": 1016.25,
      "expected_amount": 1016.25,
      "delta": 0.0,
      "disposition": "accept",
      "justification": "Billed amount matches the amount determined by the governing rate card; no discrepancy found.",
      "contract_clause": "alpine-express.md \u00a72, alpine-express.md \u00a74"
    },
    {
      "invoice": "ALPINE-0726",
      "consignment_ref": "AE-3019",
      "shipment_id": "SH-4125",
      "billed_amount": 266.0,
      "expected_amount": 266.0,
      "delta": 0.0,
      "disposition": "accept",
      "justification": "Billed amount matches the amount determined by the governing rate card; no discrepancy found.",
      "contract_clause": "alpine-express.md \u00a72"
    },
    {
      "invoice": "ALPINE-0726",
      "consignment_ref": "AE-3020",
      "shipment_id": "SH-4126",
      "billed_amount": 544.5,
      "expected_amount": 544.5,
      "delta": 0.0,
      "disposition": "accept",
      "justification": "Billed amount matches the amount determined by the governing rate card; no discrepancy found.",
      "contract_clause": "alpine-express.md \u00a72"
    },
    {
      "invoice": "ALPINE-0726",
      "consignment_ref": "AE-3021",
      "shipment_id": "SH-4127",
      "billed_amount": 304.0,
      "expected_amount": 304.0,
      "delta": 0.0,
      "disposition": "accept",
      "justification": "Billed amount matches the amount determined by the governing rate card; no discrepancy found.",
      "contract_clause": "alpine-express.md \u00a72"
    },
    {
      "invoice": "ALPINE-0726",
      "consignment_ref": "AE-3022",
      "shipment_id": "SH-4128",
      "billed_amount": 561.0,
      "expected_amount": 561.0,
      "delta": 0.0,
      "disposition": "accept",
      "justification": "Billed amount matches the amount determined by the governing rate card; no discrepancy found.",
      "contract_clause": "alpine-express.md \u00a72"
    },
    {
      "invoice": "ALPINE-0726",
      "consignment_ref": "AE-3023",
      "shipment_id": "SH-4129",
      "billed_amount": 237.5,
      "expected_amount": 237.5,
      "delta": 0.0,
      "disposition": "accept",